{
  "$schema": "http://json-schema.org/draft-07/schema#",
  "title": "Meta Ads Campaign Brief",
  "description": "Input for scripts/create_campaign.py. Fills a full Campaign -> Ad Set -> Creative(s) -> Ad(s) structure. Budgets are in the ad account's MINOR units (cents for USD: 2000 = $20.00).",
  "type": "object",
  "required": ["campaign", "ad_set", "creatives"],
  "properties": {
    "meta": {
      "type": "object",
      "properties": {
        "api_version": { "type": "string", "description": "e.g. v21.0. Defaults to v21.0 / META_API_VERSION." }
      }
    },
    "account": {
      "type": "object",
      "description": "Overrides the env vars per-brief. Leave a field out to use the env var.",
      "properties": {
        "ad_account_id": { "type": "string", "description": "act_XXXXXXXX (or META_AD_ACCOUNT_ID)" },
        "page_id": { "type": "string", "description": "Facebook Page id ads run under (or META_PAGE_ID)" },
        "instagram_actor_id": { "type": "string", "description": "Optional IG account id for IG placements (or META_INSTAGRAM_ACTOR_ID)" }
      }
    },
    "campaign": {
      "type": "object",
      "required": ["name", "objective"],
      "properties": {
        "name": { "type": "string" },
        "objective": {
          "type": "string",
          "enum": ["OUTCOME_TRAFFIC", "OUTCOME_LEADS", "OUTCOME_ENGAGEMENT", "OUTCOME_SALES", "OUTCOME_AWARENESS", "OUTCOME_APP_PROMOTION"],
          "description": "OUTCOME_TRAFFIC for landing-page visits (lead magnets); OUTCOME_LEADS for on-Meta lead forms or pixel lead events."
        },
        "special_ad_categories": {
          "type": "array",
          "items": { "type": "string", "enum": ["HOUSING", "EMPLOYMENT", "CREDIT", "ISSUES_ELECTIONS_POLITICS", "FINANCIAL_PRODUCTS_SERVICES"] },
          "default": []
        },
        "buying_type": { "type": "string", "default": "AUCTION" }
      }
    },
    "ad_set": {
      "type": "object",
      "required": ["name", "destination_url", "targeting"],
      "properties": {
        "name": { "type": "string" },
        "daily_budget": { "type": "integer", "description": "Minor units, e.g. 2000 = $20.00/day. Use this OR lifetime_budget." },
        "lifetime_budget": { "type": "integer", "description": "Minor units. Requires start_time AND end_time." },
        "billing_event": { "type": "string", "default": "IMPRESSIONS" },
        "optimization_goal": {
          "type": "string",
          "default": "LANDING_PAGE_VIEWS",
          "description": "LANDING_PAGE_VIEWS or LINK_CLICKS for cold traffic; OFFSITE_CONVERSIONS once a pixel has data."
        },
        "bid_strategy": { "type": "string", "default": "LOWEST_COST_WITHOUT_CAP" },
        "bid_amount": { "type": "integer", "description": "Minor units. Only with a capped bid strategy." },
        "start_time": { "type": "string", "description": "ISO 8601, e.g. 2026-08-01T09:00:00-0700. Omit to start on activation." },
        "end_time": { "type": "string", "description": "ISO 8601. Required with lifetime_budget." },
        "destination_url": { "type": "string", "description": "Landing page URL — include UTM params for attribution." },
        "targeting": {
          "type": "object",
          "description": "Meta targeting spec.",
          "properties": {
            "geo_locations": { "type": "object", "description": "e.g. { \"countries\": [\"US\"] } or cities/regions." },
            "age_min": { "type": "integer" },
            "age_max": { "type": "integer" },
            "genders": { "type": "array", "items": { "type": "integer" }, "description": "[1]=male, [2]=female, omit/[] = all." },
            "publisher_platforms": { "type": "array", "items": { "type": "string" }, "description": "e.g. [\"facebook\", \"instagram\"]" },
            "flexible_spec": { "type": "array", "description": "Interest/behavior AND/OR groups. Each interest needs a real Meta id." }
          }
        }
      }
    },
    "creatives": {
      "type": "array",
      "minItems": 1,
      "description": "One ad per creative. Give 2-4 variations to let Meta optimize.",
      "items": {
        "type": "object",
        "required": ["primary_text", "headline"],
        "properties": {
          "name": { "type": "string", "description": "Internal name; defaults to the headline." },
          "primary_text": { "type": "string", "description": "The main body copy above the image." },
          "headline": { "type": "string", "description": "Bold headline under the image." },
          "description": { "type": "string", "description": "Optional link description line." },
          "image_url": { "type": "string", "description": "Publicly reachable image URL (e.g. a hosted Canva export)." },
          "call_to_action": { "type": "string", "default": "LEARN_MORE", "description": "LEARN_MORE, SIGN_UP, GET_OFFER, DOWNLOAD, SUBSCRIBE, GET_STARTED, ..." }
        }
      }
    }
  }
}
